date,port,terminal,commodity,vessel_count,shipment_volume_tonnes,destination,source,source_url,collected_at,note
2026-05-01/2026-05-31,Port Hedland,All load terminals,Iron Ore,,51029634,,Pilbara Ports,https://www.pilbaraports.com.au/pilbaraportsauthority/media/documents/port%20of%20port%20hedland/about%20the%20port%20of%20port%20hedland/port%20statistics%20and%20reports/cargo%20by%20destination/2026/cargo-stats-by-destination_origin_may2026.pdf,2026-07-06T13:49:27+08:00,"Latest available monthly cargo-by-destination PDF as of collection. Port Hedland May 2026 total loaded iron ore."
2026-05-01/2026-05-31,Port Hedland,All load terminals,All loaded cargo,,51369013.24,,Pilbara Ports,https://www.pilbaraports.com.au/pilbaraportsauthority/media/documents/port%20of%20port%20hedland/about%20the%20port%20of%20port%20hedland/port%20statistics%20and%20reports/cargo%20by%20destination/2026/cargo-stats-by-destination_origin_may2026.pdf,2026-07-06T13:49:27+08:00,"Latest available monthly cargo-by-destination PDF as of collection. Includes containers, copper concentrates, general, hydrocarbon, iron ore, manganese ore and spodumene concentrate."
2026-07-01,Port Hedland,Shipping program,Capesize vessels,5,,,Pilbara Ports,https://www.pilbaraports.com.au/ports/port-of-port-hedland/port-operations/shipping-schedule,2026-07-06T13:49:27+08:00,"Shipping program as of 2026-07-01 22:24 listed 5 Capesize-class movements on 2026-07-01; program shows vessel/DWT/timing, not loaded cargo tonnage."
2026-07-02,Port Hedland,Shipping program,Capesize vessels,9,,,Pilbara Ports,https://www.pilbaraports.com.au/ports/port-of-port-hedland/port-operations/shipping-schedule,2026-07-06T13:49:27+08:00,"Shipping program as of 2026-07-01 22:24 listed 9 Capesize-class movements on 2026-07-02; program shows vessel/DWT/timing, not loaded cargo tonnage."
2026-07-03,Port Hedland,Shipping program,Capesize vessels,8,,,Pilbara Ports,https://www.pilbaraports.com.au/ports/port-of-port-hedland/port-operations/shipping-schedule,2026-07-06T13:49:27+08:00,"Longrange shipping program listed 8 Capesize-class movements for 2026-07-03; program shows vessel/DWT/timing, not loaded cargo tonnage."
